상품명,별점,리뷰 제목,리뷰 내용,카테고리1,카테고리2
"농우 타코야끼 (냉동), 1kg, 1개",5,❝ 제일 저렴한데 제일 맛있는 타코야끼 ❞,"• 중량 - 1kg
• 소비기한 - 2025.11.04

3-4주에 한번씩은 아파트 정문 앞에서 꼭 마주했던 타코야끼 트럭 아저씨
겨울 되면 더 자주 오실줄 알았는데 어느 순간 안보이더라구요..
종종 집에 오는길에 사와서 먹곤 했는데
더군다나 막 만들어 사오면 입천장 다 까질 정도로 뜨겁지만
또 그 맛이 더욱 일품이었거든요

그 맛이 그리워서 다른데서도 사 먹어보고
집 앞에 대형 식자재마트에서도 냉동타코야끼가 있어서 사먹어봤는데 역시나..
퇴근길에 마주한 타코야끼맛에는 미치질 못했습니다

다신 맛 볼수 없을까싶어서 쿠팡에서 나도 모르게 타코야끼 검색중..
1kg인데 가격이 오천원대라 식자재마트에서 샀을때보다도 훨씬 사더라구요
근데 농우라는 브랜드 네임이 생소해서 과연 맛이 있을까 싶으면서도
우선 가격대가 너무 저렴하니까 속는셈 치고 주문해봤어요

그동안 다른 브랜드꺼는 기대에 못미쳐 이번에도 큰 기대는 안했었어요
역시 쿠팡 로켓배송 짱 빨라서 출근할때 주문하고 퇴근할때 받았네요

바로 튿어 신랑이랑 간단히 먹을만큼 에어프라이어에 돌렸어요
180도로 4분정도 예열해주고 10분 돌렸어요
예열 안하면 그냥 12분 돌려주면 돼요
중간에 한번 열어서 집게로 타코야끼 뒤집어주면 되니
뭐 따로 할건 없어서 프라이팬에 하는것보다 오백배 간편해요

윤기 촤르르 도는 타코야끼 위에 취향껏 마요네즈, 데리야끼소스 뿌려주고
원하면 치즈소스나 스리라차소스 뿌려줘도 되구요
그 위에 가쓰오부시 촤라라 뿌려주면 끝!

우선 눈으로 보이는 비쥬얼 굿
코로 들어오는 스멜도 역시 굿굿
참을 틈 없이 신랑이 하나 집어 입으로 넣는데
막 말을 못하고 입을 못 다물더라구요
왜 그러나 봤더니 너무 뜨겁데요 ㅋㅋ
입천장 까지는거 조심해야겠지만 그걸 감수할정도로 너무나 맛있다네요
직접 먹어보니 밀가루의 텁텁함이나 밍밍함이 느껴지지 않아 우선 좋았고
문어도 쫄깃하게 씹히는게 이거 완전 짱맛이네요!
지금까지 사다 먹어본 냉동 타코야끼중에 제일 입에 잘맞고 맛있어요
괜히 가격 저렴하다고 쓸데없이 의심을 했었네요

앞으로 냉동실에 타코야끼 떨어지지 않게 더 쟁여둬야겠어요
분명 신랑이 5개 먹는다고 해서 14개 구웠더니 신랑이 9개 먹었어요
왜 그러시는거죠?


• 추천 대상
✔️ 집에 오는길 타코야끼 트럭보고 그냥 집에 와봤다면
✔️ 아이들 간식으로
✔️ 간단한 술 안주로


✨ 솔직한 후기가 현명한 소비에 도움되셨으면 좋겠어요 ✨",주방용품,냄비/프라이팬
"스넬 식기세척기 세제 올인원 30개입 600g, 20g",5,❝ 물자국 없이 깨끗한 스넬 올인원 세척제 ❞,"• 중량 - 20g x 30개입
• 제조일자 - 2023.07.15

쿠팡에서는 처음으로 식세기 세제를 사봤어요
벌써 식세기 이모님과 함께한지 어느덧 3년
그동안은 매번 집근처 대형 마트에서 1+1 이벤트 할때나
할인 행사 있을 때만 사다가 썼던것 같네요
어차피 세제는 거기서 거기란 생각이 있었거든요

근데 식세기 사용 후에 요즘따라 더 물자국도 눈에 띄고
해산물을 자주 먹다보니 비린내도 남아 있는것 같더라구요
그래서 온라인으로 하나하나 따져보고 알아보면서 새로운걸로 써보기로 했어요

코인형은 하나가지고는 부족해 항상 몇개씩 넣기 일쑤라
처음부터 대용량에도 하나씩 사용 가능한걸 찾다가 스넬을 알게됐어요
로켓 배송 받아 받자마자 식세기 돌려봤네요
그리고 이제 알았어요
세제도 다 같은 세제가 아니라는거... ㅎ

왜 스넬 세제를 이제 알았을까 싶네요
이전에는 식세기 세제를 아무리 많이 넣고 돌려도
세척이 덜 돼 기름기가 남을때도 많았고
고기나 해산물 먹고 나서도 비릿한 냄새가 가시지 않았던 적이 허다하거든요
특히나 물비린내 정말 정말 싫었어요 ㅠㅠ
그리고 세제랑 린스 따로 사용하는것도 생각보다 굉장히 번거로웠어요

이런 단점들이 자꾸 쌓이니 식세기를 계속 써야하나 고민도 하면서
손설거지 하는 횟수가 더 많아지면서 골치가 아프더라구요
집에서 설거지 담당인 신랑이랑 상의 끝에 세제를 먼저 다른걸로 바꿔보고
그러고도 같으면 그때가서 생각하자 했는데 정말이지 바꾸길 잘했어요!!
집에 식세기 두고도 잘 안쓰시는 분들은 세제 꼭 바꿔보세요!

일단 올인원이라는게 정말 편리하고 마음에 드네요
사용하기 전에는 세제랑 린스를 하나로 사용해도 괜찮을까?
굳이 그럼 왜 다른 제품들은 세제랑 린스를 따로 만들까? 였는데
직접 써보니 괜한 의심이었더라구요 ㅎㅎ

타블렛 하나에 20g이라서 이전에 써봤던 코인이랑은 크기 자체가 다르네요
사이즈도 크고 단단하면서 묵직해요~
12인용 세척기에 맞는 용량이라니 하나만 넣으면 끝이라 완전 최고!

사용하고 나서 미끌거리는 기름기 전혀 없이 뽀득뽀득 한데다
꿉꿉한 물비린내, 해산물 비린내 1도 없어 정말 정말 만족스러워요~
자주 보였던 하얀 물자국도 안보이고 아주 반짝반짝합니다 ㅎㅎ

식세기는 잘못이 없었어요
세제를 제대로 된걸 안쓴 제가 잘못했었네요 ㅋ
30개입에 가격도 만원이 안하니 감사합니다 ♡


• 추천 대상
✔️ 식기세척기 세정력에 만족 못하는 분
✔️ 세제, 린스 따로 쓸 필요없이 하나로 끝내고 싶으신 분


✨ 솔직한 후기가 현명한 소비에 도움되셨으면 좋겠어요 ✨",생활용품,청소/주방세제
"국내산 미니 파프리카, 200g, 1개",5,❝ 앙증맞은 사이즈의 국내산 미니 파프리카 ❞,"• 중량 - 200g
• 소비기한 - 빠르게

요리하면서 예쁜 플레이팅을 위해서는 다채로운 컬러가 필요한데
그런 느낌 내는데는 파프리카 만한게 또 없죠~

파프리카 사러 마트 갔는데 가격이 무슨일이죠..?
파프리카 하나에 삼천원 가까이 오른적은 처음 본것 같은데 이게 맞나요?
결국 마트에서 그 비싼 금프리카는 데리고 올 수 없었네요

근데도 자꾸 눈에 아른거려서 쿠팡에서 검색하니
가격대도 저렴하면서 사이즈도 귀여운 미니파프리카가 보이네요
월남쌈 만들어 먹으려니 굳이 큰 사이즈는 필요가 없더라구요
미니 사이즈라니 크기가 어떻게 되는지 알 수가 없어서 잠시 고민하다가 주문!

직접 받아본 파프리카는 몹시도 귀엽습니다 ㅎㅎ
근데 배송중에는 아닌것 같은데 포장 비닐이 찢어져 있더라구요?
뭐, 프레쉬백에 담겨져 있던거라서 큰 상관은 없었지만요~

여자 작은손인데 손바닥 안에 쏙 들어오는 앙증맞은 크기에
빨강색 파프리카 5개, 주황색 1개, 노란색 1개가 왔어요
개인적으로 골고루 색상 맞춰 보내주셨으면 좋았을텐데 살짝 아쉽긴 하네요

파프리카 색에 따라서 효능도 다르다는거 아시죠?
빨강색 파프리카는 칼슘, 인, 리코펜이 많이 들어 있어서 노화방지에 도움을,
주황색 파프리카는 철분, 베타카로틴이 많아 피부 건강에 도움을,
노랑색 파프리카는 피라진, 루테인이 많아 혈관건강과 시력보호에 도움이 된답니다.

뭐 일일이 색깔 따져가면서 먹지는 않지만,
그래도 색 맞춰 음식 만들어 놓으면 보기에도 예쁘고 먹기에도 기분 좋네요~

월남쌈 만들때 오히려 미니 사이즈라서 슬라이스 하기 더 편해요 ㅎㅎ
샐러드에도 넣어 먹으니 아삭아삭하고 상큼하니 아주 맛있어요 ^^
까나페 먹을때도 색깔별로 다져 올리니 너무 예뻐요!
딱 한번씩 사용할 양이라서 오히려 썰어놓고 남겨 물르지 않아 좋아요


• 활용 방법
- 월남쌈 재료
- 샐러드
- 피자
- 감바스

• 추천 대상
✔️ 요리에 다채로운 컬러로 포인트 주고 싶으신 분
✔️ 한번에 적은양의 파프리카 소비를 하시는 분


✨ 솔직한 후기가 현명한 소비에 도움되셨으면 좋겠습니다 ✨",헬스/건강식품,샐러드/닭가슴살
"국내산 부추, 300g, 1개",5,❝ 마트보다 싸게산 국내산 부추 ❞,"• 중량 - 300g
• 소비기한 - 빠르게

요즘 야채 물가가 아주 금값이라서 마트 가서도 쉽게 카트에 담지 못하는 부추
하지만 부추를 대체할 수 없는 음식을 만들어 먹을때가 종종 있어서
혹시나 하고 쿠팡에서 검색하니 마트보다 훨씬 저렴하네요!
은근 여기저기 활용도가 높아서 고민없이 주문했어요

2인가족이라서 야채 대용량으로 사두면 다 소비 못하고 버리게 되는 경우가 많아 300g이 어느정도 양인지 감이 안왔는데, 생각보다 양이 꽤 되네요

제일 먼저 주말에 캠핑에서 훈제오리 구워먹으면서 곁들여 먹으려고
부추 가져가서 반 이상은 소비하고 왔네요 ㅋ
오리 기름에 같이 부추를 구우니까 더 고소하면서 은은한 부추향에 아주 꿀맛!
기름기 많은 육류에 부추가 가장 무난하게 잘 어울리더라구요

그렇게 먹고 와서도 부추가 남아서
월남쌈 만드는데 사용하고
오이소박이 속 만드는데 쫑쫑 썰어 사용하고
그래도 남아서 새우 부추전 만들어 먹으니 이제 다 소비했네요 ㅎㅎ
둘이 먹어서 그런건지 아주 다양하게 활용해 먹었어요~
남기는거 없이 알뜰하게 잘 소비해서 다행이네요
매번 야채 물러져서 버리는거 투성인데..

전체적으로 부추가 깨끗한 편이지만 줄기쪽은 흙이 아직 남아 있어서
줄기 끝을 어느정도 맞춰준 다음에 1.5cm정도를 가위로 잘라주고 나서
흐르는 물에 부추를 씻어내니 아주 깨끗깨끗!
씻으면서 보니 줄기쪽에 시든 잎파리가 좀 붙어있긴 하더라구요
세척하면서 한번 털어내 줄 필요가 있어요

곧 재주문해서 이번에는 김밥에도 넣으려구요~
가격대가 더 착해지면 너무나 좋겠네요 ^^

• 활용 방법
- 월남쌈 재료
- 부추전
- 오이소박이 속 재료
- 부추잡채
- 김밥에 시금치나 오이 대신
- 부추무침
- 기름기 많은 육류와 함께 곁들임

• 추천 대상
✔️ 고물가 시대에 저렴한 부추를 찾으시는 분
✔️ 복잡한 손질없이 깨끗한 부추를 원하시는 분
✔️ 요리에 초록의 싱그러움을 불어넣고 싶으신 분


✨ 솔직한 후기가 현명한 소비에 도움되셨으면 좋겠습니다 ✨",헬스/건강식품,곤약/방탄커피 외
"한성기업 몬스터크랩 맛살, 142g, 2개입",5,❝ 결대로 찢어지는 쫄깃한 몬스터크랩 맛살 ❞,"• 중량 - 142g x 2개입
• 소비기한 - 2024.02.14

얼마전 마트 갔다가 내가 너무나 좋아하는 크래미가 보여서 신나게 달려갔는데 글쎄 가격 보고 나니 쉽사리 카트 안에 담을 수가 없더라구요...
아쉬운 마음 다잡고 집에 왔는데도 게맛살이 눈에 아른아른!
혹시나 해서 쿠팡에서 검색하니 마트에서 봤던것보다 가격이 더 저렴하네요?
마트에서 5-6천원대였는데 쿠팡에선 4천원대니 개이득!!

한팩에 142g으로 총 4개가 들어있는데,
2개씩 크랩 집게발처럼 진공포장되어 있는게 아이디어 정말 좋네요~
단순히 압축만한 포장이 아니라 집게모양이라서 더 맛있어보이기도 하구요

개인적으로는 사조꺼보다 한성 몬스터크랩이 더 쫄깃하고 맛있어요
사조꺼는 결대로 찢다보면 뚝뚝 끊겨버리기 일쑤지만,
한성꺼는 결대로 찢으면 그대로 끊김없이 잘 찢어져요
그래서 월남쌈 만들어 먹는데 호다닥 찢어놓기도 좋네요
268가닥이라는데 일일이 찢어서 세어볼 수는 없으니..ㅎ

퍼석하거나 퍽퍽한 밀가루맛이 나지 않고 촉촉하면서 은근 짭잘하니
일반 맛살과는 맛의 급이 다릅니다!
명태연육이 80%, 붉은대게살은 2% 뿐이지만 대게살 맛과 차이가 크지 않을 정도로 아주 만족스러워요 ^^

냉장고에 있으면 이런저런 요리에도 활용이 가능하고
맛살 하나 추가해 줬을 뿐인데 음식 맛에 퀄리티가 올라가니 자주 애용할 수 밖에 없네요~
저녁에 술 한잔하면서 2차 안주로 이것저것 차리기 귀찮을 때
바로 냉장고에서 꺼내서 먹기에도 아주 좋아요
마음같아서는 한박스를 쟁여두고 싶을 정도네요.. ㅎㅎ


• 활용 방법
- 술안주로 그냥 먹기
- 월남쌈
- 유부초밥 위에 얹어서 맛의 퀄리티 높이기
- 샐러드
- 까나페

• 추천 대상
✔️ 밀가루맛 나는 맛살이 아닌 쫄깃한 맛살 드실 분
✔️ 요리에 퀄리티를 높이고 싶으신 분
✔️ 마트보다 저렴하게 맛살 주문하실 분


✨ 솔직한 후기가 현명한 소비에 도움되셨으면 좋겠습니다 ✨",헬스/건강식품,곤약/방탄커피 외
"S&W 파인애플 슬라이스, 836g, 1개",5,❝ S&W 파인애플 슬라이스 ❞,"• 용량 - 836g
• 소비기한 - 2026.10.23

오랜만에 월남쌈이 너무 먹고 싶은데,
월남쌈 한번 만들어 먹으려면 이것저것 준비해야 할 재료도 한두가지가 아니고...
그래서 계속 미루고 참아오다가 신랑 생일파티를 집에서 하면서 가족들을 초대해 홈파티엔 역시 월남쌈만큼 알록달록 예쁘면서도 건강식이 또 없지 싶어 쌈 재료들과 절대 빠질 수 없는 파인애플을 찾아봤어요

집 옆에 식자재마트라서 저렴한 품목이 많은 편인데도
쿠팡과 비교했을때 쿠팡이 더 저렴한 제품이 많은 편이에요

특히 월남쌈에 정말 빠지면 안되는게 파인애플인데요,
통조림 가격도 요즘 정말 사악하더라구요

델몬트나 돌처럼 파인애플 통조림으로 유명한 브랜드는
같은 용량도 오천원 후반대로 S&W 제품과 비교했을때
가격 차이가 꽤 나네요

이전에 식자재마트에서 할인한다고 잘 모르는 브랜드 파인애플 통조림 샀다가 파인애플 슬라이스 색도 거의 하얀색이면서 맛도 싱거워 후회했던지라,
혹시나 이것도 처음 사보는 브랜드라 그러면 어쩌지 걱정을 잠시 했었는데
직접 받아보고 먹어보니 전혀 그런 걱정 안해도 됐더라구요~

주문하기 전에 잘 안살펴봐서 몰랐는데, 쿠팡에서 직수입하는 필리핀 파인애플이었네요
쿠팡 직수입이면 솔직히 믿고 먹죠 ^^

836g 중에 고형량은 505g으로 파인애플 슬라이스는 69% 들어있어요
파인애플은 음식할때나 입 심심할때 상큼하게 먹기 당연히 좋고
같이 들어있는 파인애플 주스는 소주 마실때 넣어주면 엄청 맛있어요 ㅎㅎ
꼭 따라 버리지 말고 활용해보세요~

우선 뚜껑을 오픈한 뒤에는 바로 유리나 플라스틱 용기에 파인애플 슬라이스와 주스를 같이 넣어 냉장보관해두고 먹으면 됩니다
생각보다 오래 보관해도 상하지 않아 자주 쟁여둘것 같아요!


• 활용 방법
파인애플 슬라이스: 월남쌈, 하와이안피자, 샌드위치, 요거트
파인애플 주스: 소주 또는 위스키 + 토닉워터 + 파인애플 주스
파인애플 슬라이스 + 주스를 갈아서 생과일 주스로 먹어도 짱맛

• 추천 대상
✔ 월남쌈 만들 재료로 비싸지 않은 파인애플 찾으시는 분
✔ 고물가시대에 저렴하게 파인애플 드시고 싶으신 분
✔ 상큼한 생과일 주스를 만들어 드실 분


✨ 솔직한 후기가 현명한 소비에 도움되셨으면 좋겠어요 ✨",싱글라이프,샐러드/시리얼
"딘시 프리미엄 비건 마일드 모이스트 선크림 (SPF50+PA++++), 1개, 50ml",5,❝ 딘시 프리미엄 비건 마일드 모이스트 선크림 ❞,"• 용량 - 50ml
• 사용기한 - 2026.01.25

선크림은 365일 낮이고 밤이고 필수인거 아시죠?
피부 미용을 위해서도 그렇겠지만,
피부암이라는게 엄청나게 무섭더라구요..
미리미리 자외선 차단해서 피부 건강 지키자구요!

마침 선크림이 거의 떨어져 가고 있는 찰나에
요즘 너무 건조해진 날씨 탓에 촉촉함 가득한 선크림을 찾기 시작했어요

우선 저는 백탁현상, 밀림현상, 눈시림현상 느껴지는 선크림은
절대적으로 피하고 있어요

근데 딱 눈에 띄는게, 유한양행에서 선크림을 만들었다니?
게다가 내가 원하는 모든걸 담아낸 느낌?

수분 선크림에 순한 무기자차 성분, 근데 미백에 주름 개선까지 도움된다니
선크림 하나로 영양크림 기능까지 다 되면 화장품 다이어트하고 좋잖아요 ㅎㅎ

우선, 제형이 딱 원하던 무겁지 않은 로션 질감이라 너무 마음에 드네요
무기자차는 꾸덕하면서 무거운줄만 알았는데 완전 신세계에요
촉촉하면서도 수분감이 느껴지면서 마무리감도 가벼워 피부가 편안한 느낌이에요
끈적이지 않아서 항상 유분 폭발하는 신랑도 아주 만족하네요~

유한양행꺼라서 믿고 주문해봤는데 써보니 더욱 마음에 들어요!


• 추천 대상
✔ 백탁현상, 밀림현상, 눈시림 없는 선크림 찾으시는 분
✔ 수분감 채워주는 촉촉한 선크림 원하시는 분


✨ 솔직한 후기가 현명한 소비에 도움되셨으면 좋겠어요 ✨",뷰티,클린/비건뷰티
"쿠프 페미닌 케어 버블 앤 퓨어 약산성 여성청결제, 1개, 150ml",5,❝쿠프 페미닌 케어 버블 앤 퓨어 약산성 여성청결제❞,"• 용량 - 150ml
• 사용기한 - 2025.01.01

주변에서 하도 좋다고 꼭 쓰라고 추천들을 해서 저도 쓰기 시작했습니다!

쿠프는 이미 일반팬티와 생리팬티 사용중이라
좋은 이미지로 각인되어 있어서 쿠프껄로 주문했어요

여자라면 Y존 전용 청결제 사용은 정말 필수일 정도로
한번 사용해보면 그 쾌적감에 정말 기분 좋네요 ^^

Y존이 워낙 예민하고 약한 부분이잖아요~
그래서 일바 바디워시 사용했다가는 쓰라리로 아플 수 있고
물로만 씻어내면 깨끗하게 씻기지 않아서 고민이죠

쿠프꺼는 약산성 제품이라서 아프거나 따가운것도 전혀 없고
씻고나서도 촉촉함이 남아있더라구요
따로 바디로션을 바르기에도 애매한데,
특히 겨울철에는 건조해져서 간지럽게 느껴졌는데
이거 사용하고 부터는 간지러움이 사라졌어요

따로 거품낼 필요없이 폼제형이라서 사용하기 더 편리하네요~
향도 상쾌해서 그날에도 아주 유용합니다 ^^
왜 진작 쓰지 않았을까, 나 어렸을땐 왜 이런게 없었을까 싶을정도로
정말 만족스러워서 주변에 추천중입니다 ㅎㅎ


• 추천 대상
✔ 여성 그 누구나
✔ Y존의 청결함이 신경쓰이는 분


✨ 솔직한 후기가 현명한 소비에 도움되셨으면 좋겠어요 ✨",생활용품,바디/세안
"이지비건 이지픽서 파우더 팩트, 퍼펙트 픽싱 브러쉬, 1개",5,❝ 이지비건 이지픽서 파우더 팩트 ❞,"• 용량 - 9.5g
• 사용기한 - 2026.02.01

개인적으로 메이크업 후에 끈적임이 남는 마무리감이나
오일리함을 너무너무 싫어해서 피니쉬 파우더를 필수로 사용중입니다

초반에 사용하던건 메이크업 포O버 루스 파우더를 쭉 사용하다가
은근한 가격적인 매리트에 스킨O드로 갈아탄지 몇년째네요

근데 가루형이 사용하다보면 가루날림이 은근 신경쓰이고
퍼프 사용에 불편함이 느껴지다보니 자연스럽게 팩트형으로 눈을 돌리게 됐어요
메이크업샵가면 항상 마무리는 브러쉬로 쓸어주시더라구요?

몇가지 제품 비교해보다가 이지비건 제품으로 주문해봤어요

우선 파란빛의 케이스가 아주 시원해보이네요 ^^
그립감도 좋아 손에 쥐기에도 좋구요~

픽싱 브러쉬는 그냥 같이 포함된 저렴한 제품으로 생각했는데
모가 굉장히 부드럽고 촘촘해서 사용감이 아주 좋아요

파우더 입자도 아주 작아서 뺨이나 이마, 코 부분에 슥슥 쓸어주면
전혀 들뜸도 없고 피부가 어찌나 보송해보이는지~
특히 눈썹이나 아이라인 종일 유지하려면 요 파우더 한번 쓸어주면 끝이에요

아침 일찍 나가서 밤 늦게까지 수정화장 없이 밖에 있어봤는데
저녁쯤 되면서 살짝씩 유분이 올라오는데 이것도 예쁘게 올라오더라구요
그래서 따로 수정화장 없이 있어도 충분히 괜찮아요 ㅎㅎ
답답함 없이 무겁지 않아서 이런부분도 아주 만족이에요!

게다가 요즘 재활용에 관심 많은데 분리만 잘해주면 100% 재활용이 가능하다니
환경까지 생각하는 마음에 앞으로도 쭉 믿고 사용하려구요~
뽁뽁이 없이 종이 포장도 넘 좋아요 ♡


• 추천 대상
✔️ 눈썹, 아이라이너 번지거나 잘 지워지는 분
✔️ 보송한 마무리감으로 피부 표현 하고 싶으신 분


✨ 솔직한 후기가 현명한 소비에 도움되셨으면 좋겠어요 ✨",뷰티,메이크업
"VELLA 단백질 코어 원캡슐 슬립 마스크 10p, 2ml, 10개",5,❝ VELLA 단백질 코어 원캡슐 슬립 마스크 10p,"• 용량 - 2ml x 10개
• 사용기한 - 2025.06.21

요즘 극도로 건조해진 날씨 때문에 얼굴이 완전 거칠거칠 푸석푸석
피부가 예민하기도 하고 거추장 스러운건 싫어라 해서
붙이는 마스크팩은 집에 있어도 손이 안가더라구요
근데 지금 뭐라도 해야할 피부상태라서...

마침 잠자는 동안 발라놓으면 되는 슬립 마스크가 보여서 주문해봤어요

10개들이로 총 10회분으로 보면 되구
개당 2ml 용량이라 적으면 어쩌나 싶었는데 너무 여유 있더라구요 ㅎㅎ
한번 얇게 바르고 나서 두세번 더 레이어드해서 발라주고도 남아서
목에까지 발라줬어요

자는동안 베개에 막 묻어나면 어쩌지 걱정도 됐는데
자고 일어나니 베개에 얼룩도 없고 깨끗하네요~
끈적이는 제형이 아니라 얼굴에 바르면 쏙쏙 영양가 있게 흡수돼요
향도 은은하니 좋아서 덕분에 잠도 잘 잔것 같아요 ㅎ

잠자기 전에 토너만 발라주고나서 캡슐 하나만 발라주면 되니 번거롭지도 않고
뭣보다도 아침에 일어나서 거울볼때가 기분 최고에요!
피부가 촉촉~한 상태에 각질이 싹 사라져있어서 매끈매끈~

아침에는 따로 클렌징제품 안쓰고 물로 가볍게 씻어내주고
기본 스킨케어에 메이크업해주면 들뜨는거 없이 화장도 넘 잘 먹네요

저는 매일 사용하지는 않고 일주일에 2번정도씩 주기별로 해줘요
한번 사용으로도 3-4일은 충분히 유지되는것 같아요 ^^


• 추천 대상
✔️ 겨울철 극건성 피부
✔️ 마스크 시트 팩 사용은 번거로운 분


✨ 솔직한 후기가 현명한 소비에 도움되셨으면 좋겠어요 ✨",뷰티,스킨케어
