상품명,별점,리뷰 제목,리뷰 내용,카테고리1,카테고리2
"닥터바이오 씨솔트 릴렉싱 탈모 샴푸 750ml, 1개",5,풍성해져라 얍!,"요즘들어 바닥에 떨어지는 머리카락이 눈에 띄게 많아졌더라구요..
최근 탈색+염색을 해서 그런지 극손상되면서 머리카락도 많이 빠져요

미리미리 관리 잘해야 나중에 후회안하겠지 싶어
처음으로 탈모 완화 샴푸를 사봤네요 ㅎ

워낙 열이 많은 타입인데 두피에도 역시나 열감이 많거든요
이건 쿨-샴푸라서 열감도 낮춰주고 정신이 맑아지는 기분이랄까 ㅋ
투명한 젤같은 제형인데 거품이 쫀쫀하고 풍성하게 잘나요
거품이 두피에 딱붙이라 씻고나면 두피가 엄청 개운해요~

용량도 대용량이라 오래오래 쓰겠어요^^
신랑도 써보더니 시원하다고 좋아하네요",생활용품,헤어
"티블레스 앤틱 바디워시 허브블랙티향, 500g, 2개",5,숲에 와있는듯한 자연향~,"바디워시 고를때 중요하게 따지는 하나가 바로 향인데요,
숲, 나무, 풀 같은 그린의 향을 좋아한다면 이게 딱일듯해요 :)

샤워하는 시간 만큼은 급하지않고 느긋한걸 좋아하는데
덕분에 자연의 힐링 받는 기분이 들정도로 향이 은은하고 좋아요~
허브와 우디, 연한 꽃향이 나는 차를 마시는 느낌이 나네요

특히 잠자기전에 샤워하고 나면 은은한 허브향 덕분에
편안한 기분이 들어 잠도 솔솔 잘와요 ㅎ
따끈한 허브티 마시고 노곤노곤해지는 그상태 ㅎㅎ

물처럼 묽은 제형으로 손에 덜어 사용하기 보다는
버블망에 덜어 거품내서 사용하는게 잘맞아요 참고하세요 ^^",뷰티,바디
"카미안느 기미생성방지 밤 기미크림, 50g, 1개",5,미리미리 대비해야죠^^,"30대 중반이 넘어가니 스믈스믈 기미가 올라오는것 같아서
서둘러서 비교해보고 주문했어요~

케이스 자체가 엄청 고급스러우면서 예쁘다보니
화장대에 올려두는것만으로도 기분 좋아지네요 ㅎㅎ

상자 아래에 스파출러도 동봉되어 있어서 위생상도 안심돼요
기미 예방 차원에서 얼굴 전체에 펴바르는데
피부에 보호막 씌운것같은 느낌이에요~
피부가 매끈해져서 낮에는 기초마무리단계로 바르면 화장도 잘먹고
밤에는 슬리핑팩같이 사용하고 있어요

옅은기미는 기분탓인지 더 옅어진 느낌? 이에요 ^^",뷰티,스킨케어
"제이픽스 호텔식 2배 나비주름 쉬폰 커튼 2p, 화이트, 200 x 230cm",5,차르르 떨어지는 쉬폰 커튼,"거실이 워낙 볕이 강하게 들어와 암막커튼을 해야하나 알아보던중에
감성은 놓칠 수 없어 쉬폰 커튼으로 설치했어요


● 사이즈 가로 세로 TIP ●

창문 사이즈는 가로 320 x 세로 220 정도 되는데
커튼사이즈가 가로 200 두장이라 400이니 여유있어요
이미 주름이 예쁘게 잡혀있어서 창이나 벽면 가로 400까지 충분합니다

커튼 세로사이즈가 230이라 커튼핀을 접선에 맞춰 달아줬더니
바닥 끌림도 없이 딱 맞아 지저분해지지도 않겠어요~
커튼 달 벽면 세로길이에 맞춰서 커튼핀을 끼워주면
맞춤형보다 저렴한 가격에 딱맞는 길이 커튼으로 사용이 가능하답니다


● 재질 & 비침정도 ●

항상 오후1시부터 3시까지는 볕이 쎄게 들어와 덥기도 했는데
커튼 달고나니 의외로 볕을 아주 잘막아주네요
쉬폰 재질이라 비침은 예쁘면서 볕도 잘막아주니 답답함도 없어요

암막커튼 했으면 집도 좁아보이고 낮에도 밤처럼 답답했을텐데
역시 거실은 차르르 쉬폰 커튼이 답이었네요 ^^


● 만족도 ●

진작 달아줄껄 하는 아쉬움이 들정도로 만족도가 정말 좋아요!
답답함없이 빛차단도 잘되면서 예쁘기까지하니
안방에 안막커튼도 이참에 쉬폰커튼으로 바꾸고 싶어요 :-)

쿠팡체험단 이벤트로 상품을 무료로 제공 받아 작성한 구매 후기입니다.",홈인테리어,F/W 침구샵
"닥터바이오 랩업 트리트먼트 베이비바닐라향, 750ml, 1개",5,기분좋은 베이비 바닐리향 ♡,"마침 트리트먼트 똑 떨어져가서 이번엔 새로운거 써보고싶어
닥터바이오 트리트먼트를 주문해봤어요

닥터바이오꺼는 워낙 성분이 순하고 믿을 수 있는데
트리트먼트까지 있더라구요 ^^
내꺼다 싶어 냉큼 주문하니 새벽배송돼서 아침에 바로 써봤어요

이전에 쓰던거랑은 다르게 더 되직한 질감이더라구요
헤어에 촵촵 발라도 물이랑 섞여 흐르거나 떨어지지않고
머리카락에 잘붙어있네요~

그리고 펌핑 하자마자 은은하면서 포근한향에 하트뿅뿅♡
일반 베이비파우더향은 너무 흔하고 질려있던터였는데,
바닐라향이 섞이니 이렇게 따듯한 향이 나네요
포근포근 보송보송향 트리트먼트로 마무리하니 말리면서도 기분 좋아요~

근데 트리트먼트 750ml는 처음인데 진짜 크네요 ㅋ
향이랑 다르게 양은 짐승이에요오",생활용품,헤어
"[앱솔룹] 원샷 포어 클리어패드 필링패드 각질패드145ml 60매, 1개",5,얼굴이 개운해지는 기분,"매번 바르는 토너 쓰다가 얼굴이 무거운 느낌이라 토너패드로 바꿨어요~
왜 이걸 이제야 썼는지..

분명 깨끗하게 씻었다고 씻었는데
이걸로 닦아내니 패드가 금세 누래지네요 ㅋㅋ
보기만해도 아 개운하여라~~

집게 들어있어서 손가락 넣어 한장씩 갈라주며
빼지않아도 되니 위생적이기도 하네요

양면 재질이 달라 요철면으로 먼저 얼굴 전체 닦아준뒤에
특히 각질 잘 쌓이는 코, 이마 중심으로 한번 더 문질러주고
뒷면으로 마무리해주면 피부가 아주 매끈매끈 물광나요

요즘 각질 폭발해서 문제 부위에 팩처럼 올려놓으니
각질이 잠잠~ 해졌어요 ㅋ

각질 제거 성분 때문에 혹여나 따갑거나 자극적이진 않을까
걱정도 됐는데 걱정보다 훨씬 순하고 오히려 피부가 시원해져요
답답함없이 얼굴이 말끔해지는 기분 아시나요 ㅎ
사계절 다 사용 할 수 있는 타입이라
대체할만한 다른게 나오지 않는 이상 쭉 이것만 쓸듯하네요

60장들이라 딱 한달용이니 자주 쟁여야하는건 어쩔 수 없지만요~",뷰티,클렌징/필링
"풀무원건강생활 비오텐케어, 1개, 13.5g",5,여드름과 탈모 둘다 잡는 하루 한알,"요즘 얼굴에 거의 없던 트러블이 올라오기 시작하더니
점점 여기저기 번져가기도 하고 자꾸 손대게 되더라구요
성인 피부트러블 스트레스받아 알아보니 약국에서 판토테닌 추천해주셔서
믿을 수 있는 풀무원껄로 골랐어요

★판토테닌이나 비오틴은 부작용이 거의 없지만 섭취시에는
비오틴+판토테닌 꼭 같이 섭취하라고 하셨어요★

딱 원하던 성분들만 모아놓은데다 하루 1알이라는게 가장 큰 장점이네요
나이 먹을 수록 자꾸 늘어가는 약 갯수, 한알이라도 줄여야죠

머리카락 빠지는것도 최근 탈색때문에 더 신경쓰였는데
마침 비오틴이 건강한 모근에 좋다니 마음도 놓이구요^^

※ 잠을 자고 일어나도 몸이 무겁고 피곤하다면
※ 성인 여드름 때문에 스트레스 받는다면
※ 점점 더 빠지는 머리카락 고민된다면
풀무원 비오텐케어가 딱입니다!",식품,선물세트관
"티블레스 화이트티 퍼퓸 바디로션 릴리머스크향, 480g, 1개",5,향도 좋고 보습력도 굿굿 :-),"우선 케이스부터 완전 내스타일이라 클릭했는데
마침 머스크향이라 하루 고민하다 주문했어요~

고민한 시간이 아까울만큼 우선 너무 고급스럽고 예쁜 케이스 덕분에
집안 어디에 둬도 인테리어가 되네요 ㅎㅎ

바디로션이니 보습감이랑 발림성이 가장 중요한 부분인데
찐득하지 않고 묽은 제형으로 살짝 투명해 피부에 바르면
무겁지않게 발려 아주 마음에 들어요^^

흔한 머스크향과는 다르게 화이트티의 깊이감도 느껴지고
은은한 꽃내음까지 블랜딩돼 매력있네요
잠자기전에 손씨고 일부러 핸드크림으로 바르고 향기롭게 자고있어요 ㅎ",뷰티,바디
"닥터바이오 수딩 페이스 앤 바디로션, 1개, 500g",5,끈적임없이 시원하게 바르는 수딩로션,"날씨가 점점 더워지는데 피부는 건조해져 자꾸 긁게 되더라구요
요즘 너무 심하게 긁게 되는것 같아서 바디로션은 발라야겠고
그렇다고 끈적이거나 무거운 느낌은 너무 싫어서
최대한 가볍게 바를 수 있는 수딩로션으로 골랐어요

케이스부터 시원한 기분이랄까, 보송한 케이스 질감부터 마음에 들어요~
향은 아주아주 은은하게 나는정도인데 상큼한향이라 기분 좋아지네요
딱 로션처럼 펌핑되는데 바르는 순간 톡톡 비타민 바르는 느낌?
시원한 앰플처럼 가볍게 발리고 흡수도 잘돼 끈적임이 전혀 없어요
근데도 신기하게 건조함은 없어지고 가려움도 사라지네요
피부가 너무 편안해졌어요~~

순한 성분이라 트러블 걱정없이 아이도 어른도 사용할 수 있네요^^

여러모로 닥터바이오 수딩로션 주문한 나자신 칭찬해요 ㅎㅎ",뷰티,바디
"조성아22 씨앤티 대왕쿠션 시카 앰플 + 리필 세트 SPF50+ PA++++, 2호 샌드베이지, 1세트",5,"21호 여름에 쓰기 딱인 컬러, 커버력","대한민국 보통의 피부톤으로 평소에는 21호를 사용하고 있어요
여름되면 아무래도 피부가 전체적으로 타면서
21호와 23호 그중간정도가 자연스러운데
이건 2호 샌드베이지가 딱 알맞은 컬러네요^^

색 선택 잘해야지 안그럼 얼굴만 하얗게 동동뜨거나 시커먼스...
조성아 브랜드는 한국인 여성 피부톤에 맞춤이랄까
이질적이지않고 목이랑도 자연스럽게 어우러져 즐겨쓰고 있어요
샌드베이지 컬러 어둡기보다는 자연스러운 베이지랍니다

손가락 네개 다 들어가는 넉넉한 퍼프크기 덕분에
한번만 찍어도 얼굴 전체 팡팡 골고루 두드리기에도 좋아요
물방울 모양이라 코옆, 눈가같은 부위도 세심하게 발려요

뭣보다 좋은건 대왕용량, 대왕크기에 리필까지 세트 구성이라
마음껏 사용하기에도 아주 좋네요

시카앰플이 함유돼 있어서 울긋불긋하게 열오른 피부도 진정시켜주고
커버력도 좋아 톤도 균일하게 맞춰줘요
쿠션만 발라도 매끈매끈 속광이 차올라 피부도 아주아주 좋아보여요
전체적으로 모든게 만족스러운 쿠션이에요 최고!",뷰티,뷰티소품
"티블레스 퍼플티 퍼퓸 바디로션 플로럴우디향, 480g, 1개",5,보습감이 만족스러워요~ ^^,"날은 따셔지는데 갑자기 바디 각질 폭발하면서 너무 건조한탓인지
간지러워 자꾸 긁게 되더라구요
마침 바디로션도 다 써서 새로운향 써보고 싶어 찾아보다가
처음 보는 브랜드에 패키지가 예뻐 끌리듯 주문했네요 ㅎ

요즘 보라색에 완전 꽂혔는데 패키지부터 고급지면서
특히 네모난게 마음에 들어요~

향에 대해 저마다 취향이 다르겠지만,
평소 차를 즐겨마시거나 우디향, 풀향을 좋아하신다면 극호일듯!
고급스러우면서도 아늑한 퍼플티와 앰버향에
바디로션 바르고나면 차분해지는 기분도 들어요

샤워하고나서 물기는 반정도만 털어내고 바디로션 발라주면
하루종일 촉촉함이 지속되니 피부가 편안해집니다 ^^",뷰티,바디
"닥터바이오 에코 올인원 클렌저 500g + 티타이드 크림 70g, 1세트",5,샤워시간 아껴주는 올인원 ^^,"클렌저 하나로 머리부터 바디까지 다 사용이 가능하니
샤워시간이 훨씬 줄어드네요 ㅎㅎ

아이들한테는 올인원워시가 익숙한데
순한 성분 덕분에 트러블 걱정은 안해도 되고
그렇다고 세정력이 약한것도 아니에요~

용량도 넉넉해 가족 다같이 사용하기에도 좋아요
샤워실 받침대도 덕분에 공간이 훨씬 여유로워졌네요

세트로 구성되어 있는 크림은 휴대하기 좋은 사이즈라서
여행이나 캠핑갈때 가지고 다니려구요 ㅎ
잘쓸게요♡",출산/유아동,출산준비물/선물
"제이코나 퓨리 솔트 클렌징 오일 200ml + 클렌징 폼 120ml 세트 2종, 1세트",5,한번에 클렌징 완료!,"저는 클렌징오일, 신랑은 클렌징폼 각자 쓰는게 다른데
제이코나에서 두가지 세트로 묶여있어 딱이다 싶어 주문했어요!

아이리무버 따로 필요없을 정도로 오일하나로 메이크업까지
한번에 싹 다 씻겨 말끔하네요~
오일로 롤링 충분히 해준뒤에 물 묻은 손으로 유화시킨뒤
물로 씻어내면 아주 깨끗하게 글리터까지 다 씻겨요^^

폼 쓰는 신랑은 확실히 얼굴에 기름기가 덜 생긴다고 하네요
그렇다고 당기거나 건조한건 아니라 써본중 제일 좋데요

예쁜 패키지 색상 덕분에 화장실도 화사해보이니 기분 좋아요~",뷰티,클렌징/필링
다담 찌개양념/김치양념세트(순두부8/정통된장8+겉절이양념 증정),5,이구성에 이가격 이맛 최고!,"이구성에 가격까지 저렴하니 안살수가 있나요 ㅋㅋ
순두부찌개는 내일 먹을 예정이라 된장찌개는 벌써 두번이나 끓여 먹었어요
냉동실에 자고있던 차돌까지 넣어주면 여기가 차돌된장맛집이에요~
간편하고 맛있고 다하네요 ㅋ
겉절이도 뚝딱 만들었는데 아주 꿀맛이에용",식품,장/소스/드레싱/식초
"라보르 프렌치 콜라겐 레드핏 석류맛 30p, 1개, 60g",5,탱탱한 피부를 위해^^,"날씨도 건조하고 기분도 쳐지고 피부도 쳐지고..
바르는 화장품으로는 채워지지않아 먹는 콜라겐을 시작해봤어요

이전에 피쉬콜라겐 먹었을때 비릿한 냄새때문에 먹기 힘들어서
이번에는 열심히 찾아 석류맛을 겟!!

다행히도 비릿한내는 전혀없고 상큼한 석류맛이 나다보니
입에 털어넣고 물없이 오물오물 하기에도 좋아요~

하루에 한포만 먹어도 콜라겐 충전 완료되니 아주 편하네요

이거 먹으면서 부터는 잠자고 일어난 다음날 아침
피부 상태가 확실히 달라요
미스트만 뿌리고 잤는데도 촉촉하고 광도 나네요^^
역시 먹는게 남는건가봐요~",식품,건강식품
"인써티 24시간지속 오 드 퍼퓸 섬유 향수 100ml, 06.시크블라썸, 1개",5,지속력이 엄청 좋아요~^^,"인서티 섬유향수 벌써 몇개짼지 몰라요 ㅎㅎ
이번에 주문한건 시크블러썸인데 세련되고 고급스러운 벚꽃내음이에요
외출시 두번만 뿌려줘도 하루종일 나한테 꽃향이 나서
인간 벚꽃이 된 느낌이에요~
이거 쓰고 향수 쓴적이 한번도 없네요
머리아픈 알콜내가 나는것도 아닌데 이렇게 오래가다니 ^^

습한날씨에는 옷방에 한번 뿌려두면 집 전체가 향기로워요
지속력이 정말 최고에요!!
향종류도 다양하고 가격도 넘 착해 취향이나 기분에 맞춰 뿌리기 좋아요

뿌릴때도 미세하게 분사돼 물방울 맺히거나 옷에 얼룩이 생기지않아요
양도 넉넉해 하나 사두면 오래 쓰기때문에 향별로 구비해두면 좋아요~",뷰티,향수
"도리도리 패턴플레이 오리지널 아기물티슈 캡형 55평량, 10팩, 100매",5,도톰해서 좋네요^^,"물티슈 다떨어져가는데 전에 썼던건 너무 얇고 보풀생겨 다시 사기 싫더라구요
요건 캡이 붙어있어 물기도 더 잘 보존될것 같고 평이 좋아 구매해봤어요

배송도 10팩이 박스에 딱맞게 들어있어 포장부터 기분좋네요
패키지 디자인도 귀여워서 차에도 하나 두고 집에서도 사용중이에요

한장뽑아서 상도 닦고 tv다이도 닦고 보이는 여기저기 닦아도
충분한 수분감이라 참 좋네요^^
예상대로 도톰하고 특히 보풀이 안생겨서 너무 만족이에요~

자극적이지도 않고 순해서 얼굴도 손도 닦는데 촉촉하니 잘닦이고 좋아요
만족만족쓰~~",출산/유아동,출산준비물/선물
"[당일발송] 육민심서 제주 돼지 3mm 냉동 꽃오겹살 300g/500g/1kg, 500g, 1개",5,부드럽게 맛있는 제주오겹살♡,"바쁘다 바빠 현대사회라 직접 장보러 갈 시간도 아깝네요 ㅎ
고기는 온라인으로 주문하기 살짝 걱정도 되는데
신랑이 고기가 먹고싶다고 해서 쿠팡에서 주문했네요~

걱정과는 다르게 진짜 너무 맛있어서 오늘 또 주문하려구요 ㅋㅋ
주말 캠핑에 가져가려구요~

고기가 얇아 금방 구워지면서 부드럽고 고소해요!
고기기름에 김치 볶으면 짱맛, 그 기름에 밥볶으면 짱짱맛입니다 후후",식품,곤약/방탄커피 외
"웰니스 바이오 6년근 홍삼 진액 365 스틱 실속형 벌크형 10g, 30개",5,가성비 최고에요 ^^,"홍삼액기스 없으면 못사는 신랑, 은근 비용도 비용이라 찾아보니 벌크형도 있네요!
진작에 이걸로 살껄~~ 가격은 넘 착한데 성능은 같으니 이거야말로 최고!!

아침에 일어나서 물에 스틱 하나 타서 마시면 기분 좋아요 ㅎ
온몸 구석구석에 홍삼 기운이 훅훅 퍼져나가는듯 ^^
아침에 물한잔이 좋다는데 홍삼까지 같이 마시니 더 건강해지는 느낌이에요~

면역력 높이는데 이만한게 또 없는듯해요 ㅎㅎ
앞으로도 쭉 벌크형 판매해주세요♡",식품,선물세트관
"조성아22 동공미인 퍼펙트 롱앤컬 마스카라 6.5g, 블랙, 1개",5,롱과 컬 둘다 잡은 마스카라,"조성아 제품은 역시 그냥 믿고 쓰게 되네요~
기초제품부터 색조까지 딱 K화장법에 잘맞게 만드는듯 ㅎ

이거 쓰기전에 유명한 일본제품 썼었는데
한동안 화장 안했더니 굳어서 다시 사야해서
이번에는 조성아껄로 사봤어요

이제는 국내 제품이 훨씬 더 좋네요 ㅎㅎ
가루 떨어지는것도 없고
길이도 길어지면서 컬도 어느정도 짱짱하게 잡아주니
이것보다 더 좋은게 있을까요?

아침에 바르고 저녁돼도 번짐도 없고 깨끗해요
살짝의 쳐짐은 있지만 길어지고 진해진거 생각하면
이정도는 너무 괜찮아요~

엄마도 이제 눈화장 하신다해서 같은걸로 주문 또해요^^
엄마도 예뻐져야쥬♡
동공미인 라인 제품으로 다 바꿔볼까해요",뷰티,메이크업
"칸토 고농축 프리미엄 섬유유연제 파우치 머스크향 코코쥬빌레, 1개, 1.3L",5,요즘처럼 건조한 날씨에 필수!,"요즘 날씨 너무너무 건조해서 옷에서 정전기 장난 아니었거든여
스파크 튀고 난리 부르스 ㅋㅋ
언니한테 추천받아서 칸토로 바꿨더니 정전기 확실히 사라졌어요 대박

근데 더 대박인건 향이 진짜 너무 좋다는거죠
머스크향이 유연제로 있었다니..
향도 엄청 오래가서 내옷 냄새 맡을때 기분좋음 ㅋ

덕분에 세탁실도 향기로워지고 바디미스트, 향수 안뿌리고 다녀요
섬유유연제 하나 잘들였더니 만능효자네요

우리집은 세제 자동 투입이라 용량은 얼만큼씩 들어가는지는 모르지만
1.3리터라서 꽤 오래 쓸것 같아요
2인가족이라 몇달은 충분히 쓸듯.
다쓸즈음 또 사러 올게요!!",생활용품,세탁세제
"손앤박 리얼 아이래쉬 세럼 속눈썹 영양제 클리어, 1개, 15g",5,제대로 만든 속눈썹영양제!,"얼마전에 속눈썹펌 잘못해서 완전 꼬부랑거리는데다
진짜 속눈썹들이 다 제멋대로 꺾이고 눌리고 난리부르스 나가지고..
너무 흉칙하고 속상했는데 손앤박 영양제 쓰고
5일만에 속눈썹 컨디션 펌이전보다 더 좋아지게 회복됐어요!!

솔이 커브형이라 눈매라인에 딱맞아 바르기도 쉽고
솔이 따갑지않아 더 마음에 드네요
예전에 쓰던건 바른것 같지도 않게 묻은건지 뭔지 모르겠더만
확실히 속눈썹에 싹싹 발리는게 눈에 보이고 촉촉해지면서
힘이 생기니까 건강모 되는건 시간문제~~
속눈썹 영양제 지금껏 네가지 써봤는데 다 필요없었음
손앤박이 작정하고 만든듯 ㅋ

딱 아침 저녁 하루 두번만 발라주면 속눈썹이 튼튼해져요~
이제 속눈썹 회복됐으니 쭉 발라주면 길이나 숱도 더 좋아질듯^^",뷰티,메이크업
"팜밀리 타트체리 나이트 클렌즈 2주 프로그램 70ml*14개입, 70ml, 14개",5,이건 맛있네요!,"타트체리 좋은건 다들 아실테죠?
저도 면역력 증진시키려고 1,000ml짜리 두병 사다가 물에 타마시는데..
너무 시큼하고 맛없어서 도저히 못먹겠...
겨우겨우 신랑 다먹였는데 ㅋㅋ
언니가 타트체리 넘 맛나다고 그러는거에요
언니는 뭐먹는데 맛나냐고 물어서 같은걸로 저도 사봤어요

근데 이건 진짜 맛있어서 전혀 거부감이 없네요!
번거롭게 물에 희석하지 않아도되니 더 손이 자주가요^^

콜라겐, 히알루론산, 엘라스틴 등 피부에 좋은성분도 들어있어서
신체 면역력, 피부 면역력 다 높아지는것 같아요~
덕분에 제시간에 잘자고 아침에도 가뿐하게 잠이 깨네요
피부 건조감도 훨씬 덜해서 화장도 잘먹어요

대신 하루에 한포만 먹어도 2주면 끝이라 자주 사둬야겠어요~",식품,건강식품
리즐리 올인원 주름 콜라겐 보습 멀티밤 스틱 3개,5,멀티밤을 샀더니 한보따리가 왔네요,"아니 이정도면 가성비 완접 갑of갑 아닌가요???
멀티밤 2개도 안되는 가격에 이렇게나 구성이 좋네요

""멀티밤이 무려 3개+핑크 쿠션+핸드크림 60ml 2개+파우치 까지""

솔직히 이전에 사용했던 유명 멀티밤은 좋긴 좋은데
가격이 너무 부담되다보니 팍팍 쓰기도 애매..했던게 사실이에요

근데 릴리즈꺼는 3개구성이라 건조하고 주름 신경 쓰이는 부위에
넉넉히 문질문질 해주기에도 넘 좋네요 ㅎㅎ
게다가 플로럴향이 은은하고 기분 좋아져서 바르는 순간부터
리프레쉬 되는 느낌이랄까 ^^
요즘 극건조해진 날씨탓에 각질도 올라오고 간지러웠는데
릴리즈 멀티밤 슥슥 발라주니 피부도 편해지고
반짝반짝 광채가 올라와서 피부도 엄청 좋아보여요~
화장도 잘먹어 마스크 없이도 자신감 생기네요 크크

사은품으로 보내주신 핑크쿠션이 23호 컬러인데
다가오는 여름 대비해서 23호가 마침 필요했거든요
그렇다고 너무 다크한건 아니고 목이랑 이질감없이 잘 맞아요~
(평소 21호 베이지 사용하는 얼굴입니당)
일어 가득해서 뭐지 싶었는데 일본에서 판매중인 베스트셀러 쿠션이네요 ㅎ

핸드크림도 하나 아닌 두개나 각각 다른 향 보내주셨어요
피치핑크, 머스크로즈 각자 다른 매력이 있는 향이에요
향도 좋은데 거칠거칠 손등도 촉촉하게 만들어주니 땡큐에요♡

파우치는 목욕탕 들고 다니기 좋을것 같네용 ㅎㅎ

가격대비 구성이며 성능 다 만족이에요!!
멀티밤 다 쓸즈음에 추가 구매 의향 매우 있습니다",뷰티,스킨케어
"국내산 우엉채, 500g, 1개",5,귀찮아도 직접 만들어야 맛난 우엉조림 ^^,"집근처 식자재마트에서 중국산은 더 저렴하고 양도 많지만,
믿을 수 있는 국내산으로 쿠팡 로켓프레쉬 했어요 ㅎ

채썰어져 있어서 따로 손질할 번거로움 없어 편해요~
조리고나니 씁쓸한 맛도 없고 아삭아삭 참 맛나네요^^
500g 용량이라 막상 조리해놓고 나면 많지는 않아요

김밥 쌀때 꼭 우엉을 많이 넣다보니 금방 다 먹거든요.
이번에는 남김없이 다 넣어서 반찬으로 남는것도 없어요 ㅎㅎ

키토김밥에는 계란지단, 당근, 맛살, 우엉만 넣어줘도 짱맛이네요~
우엉 덕분에 단무지 필요 없어요

우엉 매니아로써 가격만 좀 더 내려가면 좋겠네요",식품,냉장/냉동/간편요리
